"Title","Text","Time"
"HackSC is Today!","Today is the day! We can't wait to see what creativity you unleash this weekend","Fri 12:00 AM"
"Team Forming Workshop!", "Team Matching Workshop begins now in the Fun Workshop Area!","Fri 6:00 PM"
"Water Cooolers", "We have water coolers in the dinner area. Please bring your water bottles to fill them up.","Fri 6:47 PM"
"Opening Ceremony","Come to the first floor Fashion Theater for the opening ceremony!","Fri 7:15 PM"
"Team Matching Ceremony Pt. 2","We are running it back! Come join us for a Team Matching Ceremony at 9PM","Fri 9:00PM"
